{
  "section_shape": "Rectangular",
  "B": 900,
  "H": 350,
  "D": 600,
  "Lu": 2700,
  "Braced": 0,
  "k_z": 0.7,
  "k_y": 0.7,
  "cover": 40,
  "N_bl_rect": 8,
  "N_bl_circ": 8,
  "no_side_rows": 0,
  "d_b_l": 20,
  "d_b_t": 10,
  "even_reo_distribution": 0,
  "FRP": 30,
  "no_sides_exposed": 1,
  "f_c": 40,
  "f_sy": 500,
  "Nf": 500,
  "Mfz": 25,
  "Mfy": 25,
  "mufi": 0.2,
  "uid": "3007-as3600-column-fire-resistance-calculator",
  "current_unit_system": "metric",
  "project_details": {
    "project_company": "",
    "project_name": "",
    "project_designer": "",
    "project_id": "",
    "project_client": "",
    "project_notes": ""
  }
}